{
  "schema_version": "0.1",
  "scenario_id": "basic_room_001",
  "scenario_facts": [
    {
      "schema_version": "0.1",
      "scenario_id": "basic_room_001",
      "fact_id": "FACT_001",
      "time_s": 180,
      "fact_type": "action",
      "statement": "El elemento door_01 se abrió en t=180 s.",
      "certainty": "certain",
      "event_ids": [],
      "source_variables": [],
      "knowledge_topics": [],
      "requires_fact_ids": [],
      "causal": false,
      "compartment_ids": [
        "room_01"
      ],
      "action_target": "door_01",
      "action_time_s": 180
    },
    {
      "schema_version": "0.1",
      "scenario_id": "basic_room_001",
      "fact_id": "FACT_002",
      "time_s": 180,
      "fact_type": "association",
      "statement": "El Fire Event Analyzer detectó un aumento de ventilación asociado a la apertura de door_01.",
      "certainty": "high",
      "event_ids": [
        "ventilation_increase_180_room_01"
      ],
      "source_variables": [
        "upper_layer.o2_percent",
        "hrr_kw"
      ],
      "knowledge_topics": [
        "ventilation"
      ],
      "requires_fact_ids": [
        "FACT_001"
      ],
      "causal": false,
      "compartment_id": "room_01",
      "action_target": "door_01",
      "action_time_s": 180,
      "evidence_interval_s": {
        "start": 179,
        "end": 195
      }
    },
    {
      "schema_version": "0.1",
      "scenario_id": "basic_room_001",
      "fact_id": "FACT_003",
      "time_s": 195,
      "fact_type": "observation",
      "statement": "El HRR aumentó de 720 a 1280 kW.",
      "certainty": "high",
      "event_ids": [
        "hrr_increase_195_room_01"
      ],
      "source_variables": [
        "hrr_kw"
      ],
      "knowledge_topics": [
        "hrr"
      ],
      "requires_fact_ids": [],
      "causal": false,
      "compartment_id": "room_01",
      "evidence_interval_s": {
        "start": 179,
        "end": 195
      }
    },
    {
      "schema_version": "0.1",
      "scenario_id": "basic_room_001",
      "fact_id": "FACT_004",
      "time_s": 195,
      "fact_type": "observation",
      "statement": "La interfaz entre capas descendió de 1.4 a 1.2 m.",
      "certainty": "high",
      "event_ids": [
        "smoke_layer_descent_195_room_01"
      ],
      "source_variables": [
        "interface_height_m"
      ],
      "knowledge_topics": [
        "smoke_layer"
      ],
      "requires_fact_ids": [],
      "causal": false,
      "compartment_id": "room_01",
      "evidence_interval_s": {
        "start": 179,
        "end": 195
      }
    },
    {
      "schema_version": "0.1",
      "scenario_id": "basic_room_001",
      "fact_id": "FACT_005",
      "time_s": 195,
      "fact_type": "observation",
      "statement": "La temperatura de la capa superior aumentó de 390 a 475 °C.",
      "certainty": "high",
      "event_ids": [
        "temperature_increase_195_room_01"
      ],
      "source_variables": [
        "upper_layer.temperature_c"
      ],
      "knowledge_topics": [
        "temperature"
      ],
      "requires_fact_ids": [],
      "causal": false,
      "compartment_id": "room_01",
      "evidence_interval_s": {
        "start": 179,
        "end": 195
      }
    },
    {
      "schema_version": "0.1",
      "scenario_id": "basic_room_001",
      "fact_id": "FACT_006",
      "time_s": 195,
      "fact_type": "limitation",
      "statement": "Los datos disponibles no son suficientes para afirmar que la apertura de la puerta causó por sí sola el aumento del HRR.",
      "certainty": "certain",
      "event_ids": [
        "ventilation_increase_180_room_01",
        "hrr_increase_195_room_01"
      ],
      "source_variables": [
        "upper_layer.o2_percent",
        "hrr_kw"
      ],
      "knowledge_topics": [
        "ventilation",
        "hrr"
      ],
      "requires_fact_ids": [
        "FACT_001",
        "FACT_002",
        "FACT_003"
      ],
      "causal": false,
      "compartment_id": "room_01",
      "action_target": "door_01",
      "action_time_s": 180,
      "evidence_interval_s": {
        "start": 179,
        "end": 195
      }
    },
    {
      "schema_version": "0.1",
      "scenario_id": "basic_room_001",
      "fact_id": "FACT_007",
      "time_s": 195,
      "fact_type": "limitation",
      "statement": "Los datos disponibles no son suficientes para afirmar una relación causal directa entre la apertura de la puerta y el aumento de temperatura.",
      "certainty": "certain",
      "event_ids": [
        "ventilation_increase_180_room_01",
        "temperature_increase_195_room_01"
      ],
      "source_variables": [
        "upper_layer.o2_percent",
        "hrr_kw",
        "upper_layer.temperature_c"
      ],
      "knowledge_topics": [
        "ventilation",
        "temperature"
      ],
      "requires_fact_ids": [
        "FACT_001",
        "FACT_002",
        "FACT_005"
      ],
      "causal": false,
      "compartment_id": "room_01",
      "action_target": "door_01",
      "action_time_s": 180,
      "evidence_interval_s": {
        "start": 179,
        "end": 195
      }
    },
    {
      "schema_version": "0.1",
      "scenario_id": "basic_room_001",
      "fact_id": "FACT_008",
      "time_s": 195,
      "fact_type": "limitation",
      "statement": "Se ha detectado un descenso de la interfaz entre capas, pero los datos disponibles no permiten atribuirle una causa física concreta.",
      "certainty": "certain",
      "event_ids": [
        "smoke_layer_descent_195_room_01"
      ],
      "source_variables": [
        "interface_height_m"
      ],
      "knowledge_topics": [
        "smoke_layer"
      ],
      "requires_fact_ids": [
        "FACT_004"
      ],
      "causal": false,
      "compartment_id": "room_01",
      "evidence_interval_s": {
        "start": 179,
        "end": 195
      }
    },
    {
      "schema_version": "0.1",
      "scenario_id": "basic_room_001",
      "fact_id": "FACT_009",
      "time_s": 180,
      "fact_type": "observation",
      "statement": "El O₂ de la capa superior aumentó de 14.1 a 16.8 %.",
      "certainty": "high",
      "event_ids": [
        "ventilation_increase_180_room_01"
      ],
      "source_variables": [
        "upper_layer.o2_percent"
      ],
      "knowledge_topics": [
        "oxygen"
      ],
      "requires_fact_ids": [
        "FACT_002"
      ],
      "causal": false,
      "compartment_id": "room_01",
      "action_target": "door_01",
      "action_time_s": 180,
      "evidence_interval_s": {
        "start": 179,
        "end": 195
      }
    },
    {
      "schema_version": "0.1",
      "scenario_id": "basic_room_001",
      "fact_id": "FACT_010",
      "time_s": 179,
      "fact_type": "association",
      "statement": "El Fire Event Analyzer detectó un patrón temporal compatible con una condición de incendio limitado por ventilación antes de la apertura de door_01.",
      "certainty": "moderate",
      "event_ids": [
        "ventilation_limited_179_room_01"
      ],
      "source_variables": [
        "pre_open.upper_layer.o2_percent",
        "pre_open.hrr_kw",
        "pre_open.upper_layer.temperature_c",
        "post_open.upper_layer.o2_percent",
        "post_open.hrr_kw"
      ],
      "knowledge_topics": [
        "ventilation_limited"
      ],
      "requires_fact_ids": [],
      "causal": false,
      "compartment_id": "room_01",
      "action_target": "door_01",
      "action_time_s": 180,
      "evidence_interval_s": {
        "start": 150,
        "end": 195
      }
    }
  ],
  "source_events": [
    {
      "schema_version": "0.1",
      "scenario_id": "basic_room_001",
      "event_id": "hrr_increase_195_room_01",
      "time_s": 195,
      "event_type": "hrr_increase",
      "compartment_id": "room_01",
      "cause": "detected_change",
      "confidence": 0.95,
      "evidence": [
        {
          "variable": "hrr_kw",
          "previous_value": 720,
          "value": 1280,
          "unit": "kW",
          "description": "Aumento significativo del HRR"
        }
      ],
      "evidence_interval_s": {
        "start": 179,
        "end": 195
      }
    },
    {
      "schema_version": "0.1",
      "scenario_id": "basic_room_001",
      "event_id": "temperature_increase_195_room_01",
      "time_s": 195,
      "event_type": "temperature_increase",
      "compartment_id": "room_01",
      "cause": "detected_change",
      "confidence": 0.9,
      "evidence": [
        {
          "variable": "upper_layer.temperature_c",
          "previous_value": 390,
          "value": 475,
          "unit": "C",
          "description": "Aumento de temperatura de la capa superior"
        }
      ],
      "evidence_interval_s": {
        "start": 179,
        "end": 195
      }
    },
    {
      "schema_version": "0.1",
      "scenario_id": "basic_room_001",
      "event_id": "smoke_layer_descent_195_room_01",
      "time_s": 195,
      "event_type": "smoke_layer_descent",
      "compartment_id": "room_01",
      "cause": "detected_change",
      "confidence": 0.95,
      "evidence": [
        {
          "variable": "interface_height_m",
          "previous_value": 1.4,
          "value": 1.2,
          "unit": "m",
          "description": "Descenso de la interfaz entre capas"
        }
      ],
      "evidence_interval_s": {
        "start": 179,
        "end": 195
      }
    },
    {
      "schema_version": "0.1",
      "scenario_id": "basic_room_001",
      "event_id": "ventilation_increase_180_room_01",
      "time_s": 180,
      "event_type": "ventilation_increase",
      "compartment_id": "room_01",
      "cause": "door_01_opened",
      "action_target": "door_01",
      "action_time_s": 180,
      "confidence": 0.95,
      "evidence": [
        {
          "variable": "upper_layer.o2_percent",
          "previous_value": 14.1,
          "value": 16.8,
          "unit": "%",
          "description": "Aumento de oxígeno tras la apertura"
        },